Title,Description,ImageURL
The Voice Crack,A song with a flawed vocal moment that improves the song,https://media.giphy.com/media/v1.Y2lkPTc5MGI3NjExcWFjb2syN3E5cHZqdzRhZ3NuY3BqZnZsdHZvN2NjbXRraXI2MjU3aSZlcD12MV9naWZzX3NlYXJjaCZjdD1n/3orif8dO1K8o9jUHFm/giphy.gif
The Ancient Texts,A song everyone quotes,https://media.giphy.com/media/v1.Y2lkPTc5MGI3NjExcWFjb2syN3E5cHZqdzRhZ3NuY3BqZnZsdHZvN2NjbXRraXI2MjU3aSZlcD12MV9naWZzX3NlYXJjaCZjdD1n/3orif8dO1K8o9jUHFm/giphy.gif
Director Commentary,A song with behind-the-scenes lore that enhances it,https://media.giphy.com/media/v1.Y2lkPTc5MGI3NjExcjhjeWJ4Zzl0NGo4aHB4MGtvZG05bzN2eWNpdjFuZWt4bnM0azlydCZlcD12MV9naWZzX3NlYXJjaCZjdD1n/ZDKdbazHIfycp83lwW/giphy.gif
Community Patch,[Fan] Remix or edit of a song,https://media.giphy.com/media/v1.Y2lkPTc5MGI3NjExYmg3bTVnb2dpc3VtbnQ5aDF4ZnM3MDFrY2E4aW9qeTVyY25qN3NseSZlcD12MV9naWZzX3NlYXJjaCZjdD1n/SZrDDVe62DKp8qwmSy/giphy.gif
TikTok,A Song with time in the title,https://media.giphy.com/media/v1.Y2lkPTc5MGI3NjExMTg4c2EwenQ1dzVoOWZvaG91eHFzMm1rbmo4c2tzZ3l1bDh1ajI3NyZlcD12MV9naWZzX3NlYXJjaCZjdD1n/Kvjugjvc1L9iE/giphy.gif
"Sayonara, sucker","A Song about saying goodbye, or with goodbye in the title",https://media.giphy.com/media/v1.Y2lkPTc5MGI3NjExcGNucXRsNmNuam90eW1henNxMzI1NWdpb3QxcTZod2pma2lza2o0OCZlcD12MV9naWZzX3NlYXJjaCZjdD1n/l4HnXFvoy74pbrOx2/giphy.gif
I guess this is growing up,A Song about getting older,https://media.giphy.com/media/v1.Y2lkPTc5MGI3NjExNTMxeWhid200emJlcWZxZHlnaHM1aml1aXB1ams0ZGtiejd5bGRqMiZlcD12MV9naWZzX3NlYXJjaCZjdD1n/ZsHPTB5CthqCnelc8x/giphy.gif
What business is it of yours,A song about unrequited love,https://media.giphy.com/media/v1.Y2lkPTc5MGI3NjExbGlhZ3VhbmJpaWFuN2NwaW42dTZlYmc3aWI4NjZuNmFvbTJ3ejlxcCZlcD12MV9naWZzX3NlYXJjaCZjdD1n/1DqTKHz6WVree52L3F/giphy.gif
Better Off Alone,A song by an artist who was in a less popular band/group then went solo,https://media.giphy.com/media/v1.Y2lkPTc5MGI3NjExNzF5dnNkdHA1azU4b3Robnp3NXhtdW1vajloamN1emJmZDIxZmJzdCZlcD12MV9naWZzX3NlYXJjaCZjdD1n/9cgipBtD72LfmP5ooV/giphy.gif
The unexamined life,A song about loneliness,https://media.giphy.com/media/v1.Y2lkPTc5MGI3NjExbTFsNjFjYXcycHZ5amxicnVqa3Iyd3N1bnR5N2lqOHN3NG1ib2J1MSZlcD12MV9naWZzX3NlYXJjaCZjdD1n/VfyC5j7sR4cso/giphy.gif
He who has a why,"A song about having purpose, or finding meaning, or working towards a goal",https://media.giphy.com/media/v1.Y2lkPTc5MGI3NjExcTZlOWMwYWU5NG1hN3YzZzBjY2JmMnFyZ3pwZHc2MmkzbnAyeHZ0NCZlcD12MV9naWZzX3NlYXJjaCZjdD1n/Fsn4WJcqwlbtS/giphy.gif
Do you know de wae,"A song with directions, up, down, left, right or cardinal in the title or lyrics",https://media.giphy.com/media/v1.Y2lkPTc5MGI3NjExb3k1M203ZDhoeXV0dHk0ZjZsNGh3dGZkNHpwaW41azRpbjN4dnlnNSZlcD12MV9naWZzX3NlYXJjaCZjdD1n/JvV2rmcvoSNkEiyBEB/giphy.gif
Karaoke Night,A song you would queue at karaoke,https://media.giphy.com/media/v1.Y2lkPTc5MGI3NjExN2lsejhsano4OGc4MGhpdXQ0aGhrdnc5aHMyYnBiNjRuMWV0bnpydSZlcD12MV9naWZzX3NlYXJjaCZjdD1n/idKFx1AUCg1Yk/giphy.gif
Where there is smoke,A song with fire in the title,https://media.giphy.com/media/v1.Y2lkPTc5MGI3NjExcWVzZmRqcTlrazhjNHZraXFwbmtiYXF2dG9pbmRramVkNHE2YW1qNiZlcD12MV9naWZzX3NlYXJjaCZjdD1n/3KVcFEmdDl9NYaFTtx/giphy.gif
When the sun goes down,A song with night in the title,https://media.giphy.com/media/v1.Y2lkPTc5MGI3NjExZ25rZXNwZDd1M3oyeXhiaHplZndyNzdxb3piNHIwZHVmZWVwY2YxZCZlcD12MV9naWZzX3NlYXJjaCZjdD1n/YNk9HRcH9zJfi/giphy.gif
An amphibious exploring vehicle,A song with cars or other vehicles in the title,https://media.giphy.com/media/v1.Y2lkPTc5MGI3NjExeDhnams3cnFjOG80MWQ0aDNqNnhteGZxdDJlZzBza2c0bDJqcjNrNyZlcD12MV9naWZzX3NlYXJjaCZjdD1n/3ov9jWu7BuHufyLs7m/giphy.gif
Towards Another Summer,A song about home or with home in the title,https://media.giphy.com/media/v1.Y2lkPTc5MGI3NjExbTF2bGYyZGd2anJ6MWtya2I4cjM0cmJyMXNrMWd1bmIyem4ybnJuOCZlcD12MV9naWZzX3NlYXJjaCZjdD1n/W5Twuq0Fvl8POWHXDf/giphy.gif
He was number one,A song with gold in the title,https://media.giphy.com/media/v1.Y2lkPTc5MGI3NjExNGI2YW5jejYyb3p2cHo0M3BiMWVnN3dqeWl2M3ZieHd3dTY5dGwxMCZlcD12MV9naWZzX3NlYXJjaCZjdD1n/lOiJqCjiEOcmc/giphy.gif
Losing my religion,"A song about religion, church or sin",https://media.giphy.com/media/v1.Y2lkPTc5MGI3NjExMngyOGRvNjNwbzQ0aDBqenVkY3l1a2RmbmUxZHcxbjk1Yzg2bnQ0eCZlcD12MV9naWZzX3NlYXJjaCZjdD1n/3o6ZtpyeiCrEEwdZ84/giphy.gif
Green Eyed Monster,A song about jealousy,https://media.giphy.com/media/v1.Y2lkPTc5MGI3NjExYnMwMmE3cWMzdGN2ZTZ6MDNmaTFhY3RpYWgwZXQ5ajUwbTRwM280YyZlcD12MV9naWZzX3NlYXJjaCZjdD1n/buwxdL6bzFcyc/giphy.gif
Don't Dream It's Over,A song about a breakup,https://media.giphy.com/media/v1.Y2lkPTc5MGI3NjExaTJkeHcxZTFwOTh3YjA2aDh3a3FrNWNvNTVxc2gzdWMwODd1cHgzZiZlcD12MV9naWZzX3NlYXJjaCZjdD1n/SIIXDrZ8Rh2a4/giphy.gif
Stars in their eyes,A song with star in the title,https://media.giphy.com/media/v1.Y2lkPTc5MGI3NjExbW80b3Fwd2pqc2UwcHN5bXdzMGpqOTd1Znc0MWVpdjRxZjlsMHRxcSZlcD12MV9naWZzX3NlYXJjaCZjdD1n/FlodpfQUBSp20/giphy.gif
Unskippable Cutscene,A long song that you listen through anyway,https://media.giphy.com/media/v1.Y2lkPTc5MGI3NjExaW1ncXFnZHU5N3Z6YjR5ZGFmNmxndG0xZG1rc2o5cmVidXQ0MTVyZiZlcD12MV9naWZzX3NlYXJjaCZjdD1n/34W5O9hnNl7v03IZz4/giphy.gif
Microtransaction,A short interlude that leaves you wanting more,https://media.giphy.com/media/v1.Y2lkPWVjZjA1ZTQ3Z2Z1MzkzcHBmaXZ2bHpuNjk1azBldzNuM3Znc2UzdHl2M29raDZwbCZlcD12MV9naWZzX3NlYXJjaCZjdD1n/YWgVU5MevXts4vHDqV/giphy.gif
"One kick 10,000 times",A song you have listened to many times,https://media.giphy.com/media/v1.Y2lkPTc5MGI3NjExb3h6M3prM2VyN21icTNldWF3cGU1MmZkMWp6M3hmZTUzYWFobjlqYiZlcD12MV9naWZzX3NlYXJjaCZjdD1n/3o7WIQ4FARJdpmUni8/giphy.gif
